data,product_id,nome,preco,n_ofertas,item_id,seller_id,frete_gratis,permalink
2026-07-12,MLB25499886,"Leitura De Verao - 1ªed.(2022), De Emily Henry. Editora Verus, Capa Mole, Edição 1 Em Português, 2022",123.94,16,MLB6516813522,3277837440,True,False,https://www.mercadolivre.com.br/p/MLB25499886
2026-07-12,MLB26353001,"De Ferias Com Voce - 1ªed.(2022), De Emily Henry. Editora Verus, Capa Mole, Edição 1 Em Português, 2022",209.4,17,MLB4689676553,3216539717,True,False,https://www.mercadolivre.com.br/p/MLB26353001
2026-07-12,MLB34253346,"Kit Loucos Por Livros + Leitura De Verão: Não Aplica, De : Emily Henry / Tradução: Cecília Camargo Bartalotti. Editorial Verus, Tapa Mole En Português, 2022",115.91,4,MLB4514612622,366835102,True,False,https://www.mercadolivre.com.br/p/MLB34253346
2026-07-12,MLB30898776,"Loucos por livros: Não Aplica, de Emily Henry. Série Não aplica, vol. Não Aplica. Editora Verus, capa mole, edição não aplica em português, 2023",35.0,2,MLB3783972915,480263032,False,True,https://www.mercadolivre.com.br/p/MLB30898776
2026-07-12,MLB50368761,"Livro Hábitos Atômicos + 12 Regras Para A Vida: Kit Vida Organizada, Hábitos Poderosos, De Kit Vida Organizada, Hábitos Poderosos. Editorial Sextante/alta Books, Capa Mole Em Portu",110.9,9,MLB6902427164,1190545374,True,False,https://www.mercadolivre.com.br/p/MLB50368761
2026-07-12,MLB50583499,"Kit Livro Comece Pelo Porquê + Hábitos Atômicos: Kit Liderança E Disciplina, De Kit Liderança E Disciplina. Editorial Sextante/altabooks, Capa Mole Em Português",314.88,12,MLB4580152775,459019543,True,False,https://www.mercadolivre.com.br/p/MLB50583499
2026-07-12,MLB50585712,"Livro Pai Rico Pai Pobre + Hábitos Atômicos: Kit Evolução Pessoal, De Kit Evolução Pessoal. Editorial Sextante/altabooks, Capa Mole Em Português",297.15,1,MLB6845299090,16727661,True,False,https://www.mercadolivre.com.br/p/MLB50585712
